socket:gethostbyname	as-	-	-	Get the host IP in dotted notation. The host is specified by the string and the address is the start of the buffer for the dotted IP.			class:word	{n/a}	{n/a}	socket	rre	
socket:listen	nn-nn	-	-	Prepare a socket for accepting incoming quotations. Takes a backlog count (n1) and a socket (n2). Returns a flag (0 success, -1 failed) and an error code.			class:word	{n/a}	{n/a}	socket	rre	
socket:recv	ann-nn	-	-	Receive data from a socket. This will read into memory starting at address *a*, up to *n1* bytes. *n2* is the socket. Returns the number of bytes read and an error code.			class:word	{n/a}	{n/a}	socket	rre	
socket:send	sn-nn	-	-	Send a string to a socket. This will return the number of characters sent and an error code.			class:word	{n/a}	{n/a}	socket	rre	
sp	-	-	-	Display a space (`ASCII:SPACE`)			class:word	    :spaces (n-)  [ sp ] times ;\n    #12 spaces	{n/a}	global	all	
store	na-	-	-	Store a value into the specified address.			class:primitive	    'Base var\n    #10 &Base store	{n/a}	global	all	
store-next	na-a	-	-	Store a value into the specified address and return the next address.			class:word	{n/a}	{n/a}	global	all	
swap	nm-mn	-	-	Exchange the position of the top two items on the stack			class:primitive	{n/a}	{n/a}	global	all	
sys:argc	-n	-	-	Return the number of arguments passed to the program.			class:word	{n/a}	{n/a}	sys	rre	
sys:argv	n-s	-	-	Given an argument number, return the argument as a string.			class:word	{n/a}	{n/a}	sys	rre	
sys:name	-s	-	-	Return the filename of the program being run.			class:word	{n/a}	{n/a}	sys	rre	
tab	-	-	-	Display a tab (`ASCII:HT`)			class:word	{n/a}	{n/a}	global	all	
times	nq-	-	-	Run the specified quote the specified number of times.			class:word	    #12 [ $- c:put ] times	{n/a}	global	all	
times<with-index>	nq-	-	-	Run a quote the specified number of times, tracking the loop index in `I`.			class:word	{n/a}	{n/a}	global	all	
tri	xqqq-?	-	-	Apply q1 against x, then q2 against a copy of x, and finally q3 against another copy of x.			class:word	{n/a}	{n/a}	global	all	
tri*	xyzqqq-?	-	-	Apply q1 against x, q2 against y, and q3 against z.			class:word	{n/a}	{n/a}	global	all	
tri@	xyzq-?	-	-	Apply q against x, then against y, and finally against z.			class:word	{n/a}	{n/a}	global	all	
tuck	nm-mnm	-	-	Put a copy of the top item on the stack under the second one.			class:word	{n/a}	{n/a}	global	all	
unhook	a-	-	-	Reset the hook point in a1 to the default definition.			class:word	    :foo hook #1 ;\n    :bar #2 ;\n    &bar &foo set-hook\n    &foo unhook	{n/a}	global	all	
unix:chdir	s-	-	-	Change the current working directory to the specified one.			class:word	  '/etc unix:chdir	{n/a}	unix	rre	
unix:count-files-in-cwd	-n	-	-	Return the number of files (and subdirectories) in the current working directory			class:word	{n/a}	{n/a}	unix	rre	
unix:exec0	s-	-	-	Execute a process by running the application specified by s.			class:word	{n/a}	{n/a}	unix	rre	
unix:exec1	ss-	-	-	Execute a process by running the application specified by s1. Pass s2 as an argument.			class:word	{n/a}	{n/a}	unix	rre	
unix:exec2	sss-	-	-	Execute a process by running the application specified by s1. Pass s2 and s3 as arguments.			class:word	{n/a}	{n/a}	unix	rre	
unix:exec3	ssss-	-	-	Execute a process by running the application specified by s1. Pass s2, s3, and s4 as arguments.			class:word	{n/a}	{n/a}	unix	rre	
unix:exit	n-	-	-	Exit the current process, returning the specified return code.			class:word	{n/a}	{n/a}	unix	rre	
unix:for-each-file	q-	-	-	Run a quote once for each file or subdirectory in the current directory. The quote will receive the file name as a string and should consume this and return nothing on the stack.			class:word	{n/a}	{n/a}	unix	rre	
unix:fork	-n	-	-	Fork the current process. Returns a PID.			class:word	{n/a}	{n/a}	unix	rre	
unix:get-cwd	-s	-	-	Return the current working directory			class:word	{n/a}	{n/a}	unix	rre	
unix:getenv	sa-	-	-	Get an environment variable. Provide the name and an address to store it in.			class:word	  'SHELL s:empty [ unix:getenv ] sip s:put nl	{n/a}	unix	rre	
unix:getpid	-n	-	-	Return the PID of the current process.			class:word	{n/a}	{n/a}	unix	rre	
unix:io:n:put	n-	-	-	Deprecated. Display a number (in base 10) to the standard output device. This is faster than `n:put`, but not portable.			class:word	{n/a}	{n/a}	unix:io	rre	
unix:io:s:put	s-	-	-	Deprecated. Display a string to stdout. This is faster than `s:put`, but not portable.			class:word	{n/a}	{n/a}	unix:io	rre	
unix:kill	nn-	-	-	Terminates a process. Takes a process and a signal to send.			class:word	{n/a}	{n/a}	unix	rre	
unix:pclose	n-	-	-	Close a pipe.			class:word	{n/a}	{n/a}	unix	rre	
unix:popen	sn-n	-	-	Open a pipe. Takes a command to run, and a file mode (`file:R` or `file:W`; `file:R+` may work on some systems). Returns a file ID usable with words in the `file:` namespace.			class:word	{n/a}	{n/a}	unix	rre	
unix:putenv	s-	-	-	Takes a string in the form `name=value` and sets an environment variable named `name` to `value`.			class:word	  'EDITOR=vi unix:putenv	{n/a}	unix	rre	
unix:sleep	n-	-	-	Sleep for the specified number of seconds.			class:word	{n/a}	{n/a}	unix	rre	
unix:slurp-pipe	as-n	-	-	Open a pipe. Read all output from the pipe (until ASCII:NULL) and store in the specified buffer. Return the number of bytes read.			class:word	{n/a}	{n/a}	unix	rre	
unix:system	s-	-	-	Runs another application using the system shell and returns after execution is completed.			class:word	  'ls_-lh_/etc unix:system	{n/a}	unix	rre	
unix:wait	-n	-	-	Waits for a child process to complete. This maps to the wait() system call.			class:word	{n/a}	{n/a}	unix	rre	
unix:write	sh-	-	-	Deprecated. Write a string to the specified file handle.			class:word	{n/a}	{n/a}	unix	rre	
until	q-	-	-	Execute quote repeatedly while the quote returns a value of `FALSE`. The quote should return a flag of either `TRUE` or `FALSE`, though `until` will treat any non-zero value as `TRUE`.			class:word	    #10 [ dup n:put nl n:dec dup n:zero? ] until	{n/a}	global	all	
v:dec	a-	-	-	Decrement the value stored at the specified address by 1.			class:word	{n/a}	{n/a}	v	all	
v:dec-by	na-	-	-	Decrement the value stored at the specified address by the specified value.			class:word	{n/a}	{n/a}	v	all	
v:inc	a-	-	-	Increment the value stored at the specified address by 1.			class:word	{n/a}	{n/a}	v	all	
v:inc-by	na-	-	-	Increment the value stored at the specified address by the specified value.			class:word	{n/a}	{n/a}	v	all	
v:limit	alu-	-	-	Fetch the value stored at the address, then run `n:limit` against it, using the specified lower and upper bounds. Then store the resulting value back to the original address.			class:word	{n/a}	{n/a}	v	all	
v:off	a-	-	-	Set a variable to 0.			class:word	{n/a}	{n/a}	v	all	
v:on	a-	-	-	Set a variable to -1.			class:word	{n/a}	{n/a}	v	all	
v:preserve	aq-	-	-	Make a copy of the value at the address, then run the quote. Once the quote completes, restore the address to the specified value.			class:word	{n/a}	{n/a}	v	all	
v:update	aq-	-	-	Fetch a value from the specified address, then run the quotation with this value on the stack. Afterwards, store the returned value at the original address.			class:word	{n/a}	{n/a}	v	all	
var	s-	-	-	Create a variable. The variable is initialized to 0.			class:word	    'Base var	{n/a}	global	all	
var<n>	ns-	-	-	Create a variable with the specified initial value.			class:word	    #10 'Base var<n>\n	{n/a}	global	all	
while	q-	-	-	Execute quote repeatedly while the quote returns a `TRUE` value. The quote should return a flag of either `TRUE` or `FALSE`, though `while` will treat any non-zero value as `TRUE`.			class:word	    #10 [ dup n:put nl n:dec dup n:-zero? ] while	{n/a}	global	all	
xor	mn-o	-	-	Perform a bitwise XOR operation.			class:primitive	{n/a}	{n/a}	global	all	
{	-	-	-	Begin an array. This is intended to make creating arrays a bit cleaner than using a quotation and `a:counted-results`.			class:word	{n/a}	{n/a}	global	all	
{{	-	-	-	Begin a lexically scoped area.			class:word	{n/a}	{n/a}	global	all	
}	-a	-	-	Complete an array begun by `{`. Returns a pointer to the data.			class:word	{n/a}	{n/a}	global	all	
}as	f-	-	-	End an assembly section.			class:macro	{n/a}	{n/a}	global	all	
}}	-	-	-	End a lexically scoped area. This will hide any headers between `{{` and `---reveal---`, leaving only headers between `---reveal---` and the `}}` visible.			class:word	{n/a}	{n/a}	global	all	
